{"v":1,"taxonomy":[{"id":"lit","ru":"Литература","aliases":["литература","литератор","литераторы","литераторша"],"children":[{"id":"lit.poet","ru":"поэт","aliases":["поэт","поэтесса","поэты","поэтессы","стихотворец","мгосани"]},{"id":"lit.writer","ru":"писатель","aliases":["писатель","писательница","писатели","прозаик","прозаики","романист","новеллист","беллетрист"]},{"id":"lit.playwright","ru":"драматург","aliases":["драматург","драматурги","драматургия"]},{"id":"lit.translator","ru":"переводчик","aliases":["переводчик","переводчица","переводчики"]},{"id":"lit.critic","ru":"литературовед","aliases":["литературовед","литературоведы","критик","критики","литературный критик"]},{"id":"lit.journalist","ru":"журналист","aliases":["журналист","журналистка","журналисты","публицист","публицистка","публицисты","издатель","издатели","редактор","редакторы"]},{"id":"lit.character","ru":"персонаж","aliases":["персонаж","персонажи","литературный персонаж","мифологический персонаж","мифология","вымышленный персонаж","герой книги"]}]},{"id":"power","ru":"Власть и политика","aliases":["власть","политика","правители и политики"],"children":[{"id":"power.monarch","ru":"царь, правитель","aliases":["царь","царица","цари","правитель","правительница","правители","король","королева","монарх","монархи","царствовавший"]},{"id":"power.royal","ru":"царевич","aliases":["царевич","царевна","царевичи","царевны","принц","принцесса","царская семья"]},{"id":"power.noble","ru":"князь","aliases":["князь","княгиня","князья","княжна","дворянин","дворяне","эристави","аристократ","феодал"]},{"id":"power.statesman","ru":"государственный деятель","aliases":["политик","политики","государственный деятель","госдеятель","министр","министры","депутат","депутаты"]},{"id":"power.head","ru":"глава государства","aliases":["президент","президенты","глава государства","премьер","премьер-министр","глава правительства"]},{"id":"power.revolutionary","ru":"революционер","aliases":["революционер","революционерка","революционеры","большевик","большевики","нацдвижение","деятель нацдвижения"]},{"id":"power.diplomat","ru":"дипломат","aliases":["дипломат","дипломаты","посол","послы"]},{"id":"power.public","ru":"общественный деятель","aliases":["общественный деятель","общественница","общественные деятели","активист","активистка","активисты"]}]},{"id":"mil","ru":"Военные","aliases":["армия","военное дело"],"children":[{"id":"mil.commander","ru":"полководец","aliases":["полководец","полководцы","военачальник","военачальники","генерал","генералы","маршал","маршалы","адмирал","адмиралы"]},{"id":"mil.hero","ru":"герой войны","aliases":["герой","героиня","герои","героини","герой войны","погибший","погибшие","защитник","защитники","герой советского союза","национальный герой"]},{"id":"mil.soldier","ru":"военный","aliases":["военный","военные","военнослужащий","офицер","офицеры","солдат","солдаты","летчик"]}]},{"id":"rel","ru":"Религия","aliases":["религия","церковь","духовные"],"children":[{"id":"rel.saint","ru":"святой","aliases":["святой","святая","святые","преподобный","мученик","мученица","мученики","праведник"]},{"id":"rel.patriarch","ru":"католикос, епископ","aliases":["католикос","патриарх","католикос-патриарх","епископ","епископы","архиепископ","митрополит"]},{"id":"rel.clergy","ru":"священник, монах","aliases":["священник","священники","монах","монахи","монахиня","богослов","богословы","клирик","духовенство","архимандрит","дьякон"]},{"id":"rel.feast","ru":"праздник, святыня","aliases":["праздник","праздники","церковный праздник","святыня","святыни"]}]},{"id":"sci","ru":"Наука и просвещение","aliases":["наука","просвещение","науки"],"children":[{"id":"sci.humanities","ru":"гуманитарий","aliases":["гуманитарий","историк","историки","филолог","филологи","лингвист","лингвисты","языковед","философ","философы","востоковед","археолог","этнограф","экономист","искусствовед"]},{"id":"sci.natural","ru":"естествоиспытатель","aliases":["естествоиспытатель","естественник","ученый","ученые","физик","физики","химик","химики","математик","математики","биолог","биологи","геолог","астроном","ботаник","зоолог"]},{"id":"sci.medicine","ru":"врач","aliases":["врач","врачи","медик","медики","хирург","доктор","медицина"]},{"id":"sci.engineering","ru":"инженер","aliases":["инженер","инженеры","изобретатель","изобретатели","конструктор","техника"]},{"id":"sci.education","ru":"педагог","aliases":["педагог","педагоги","учитель","учительница","учителя","просветитель","просветительница","просветители","преподаватель"]},{"id":"sci.explorer","ru":"путешественник","aliases":["путешественник","путешественница","путешественники","географ","картограф","исследователь","первооткрыватель"]}]},{"id":"art","ru":"Искусство","aliases":["искусство","деятель искусства","деятели искусства"],"children":[{"id":"art.painter","ru":"художник","aliases":["художник","художница","художники","живописец","скульптор","скульпторы","график"]},{"id":"art.architect","ru":"архитектор","aliases":["архитектор","архитекторы","зодчий"]},{"id":"art.composer","ru":"композитор","aliases":["композитор","композиторы"]},{"id":"art.musician","ru":"музыкант","aliases":["музыкант","музыканты","певец","певица","певцы","исполнитель","пианист","скрипач"]},{"id":"art.actor","ru":"актёр","aliases":["актер","актриса","актрисы","актеры"]},{"id":"art.director","ru":"режиссёр","aliases":["режиссер","режиссеры","кинорежиссер"]},{"id":"art.dance","ru":"танец","aliases":["танец","танцы","танцор","танцовщица","танцоры","хореограф","балет","балерина"]},{"id":"art.other","ru":"другое искусство","aliases":["фотограф","каллиграф","другое искусство"]}]},{"id":"sport","ru":"Спорт","aliases":["спорт"],"children":[{"id":"sport.football","ru":"футбол","aliases":["футбол","футболист","футболисты"]},{"id":"sport.wrestling","ru":"борьба","aliases":["борьба","борец","борцы","тяжелая атлетика","тяжелоатлет"]},{"id":"sport.chess","ru":"шахматы","aliases":["шахматы","шахматист","шахматистка","шахматисты"]},{"id":"sport.other","ru":"другой спорт","aliases":["спортсмен","спортсменка","спортсмены","альпинист","альпинисты","другой спорт"]}]},{"id":"biz","ru":"Меценаты и предприниматели","aliases":["бизнес","меценаты и предприниматели"],"children":[{"id":"biz.patron","ru":"меценат","aliases":["меценат","меценаты","благотворитель","благотворители","филантроп"]},{"id":"biz.entrepreneur","ru":"предприниматель","aliases":["предприниматель","предприниматели","промышленник","купец","купцы"]}]},{"id":"group","ru":"Группы людей","aliases":["группы людей"],"children":[{"id":"group.heroes","ru":"коллектив героев","aliases":["коллектив героев","коллективы героев","юнкера","отряд"]},{"id":"group.family","ru":"братья и семьи","aliases":["братья","сестры","семья","семьи","супруги","династия"]},{"id":"group.profession","ru":"профессия","aliases":["профессия","профессии"]},{"id":"group.ethnos","ru":"народ","aliases":["народ","народы","этнос","этносы"]}]},{"id":"place","ru":"Топонимы","aliases":["топонимы","места","география"],"children":[{"id":"place.ge_city","ru":"город или село Грузии","aliases":["город грузии","грузинский город","село","села","деревня","город"]},{"id":"place.ge_region","ru":"регион Грузии","aliases":["регион грузии","регион","регионы","историческая область","область","край"]},{"id":"place.tbilisi","ru":"место в Тбилиси","aliases":["место в тбилиси","местность тбилиси","район тбилиси","тбилиси"]},{"id":"place.water","ru":"река или озеро","aliases":["река","реки","озеро","озера","родник","водоем"]},{"id":"place.mountain","ru":"гора","aliases":["гора","горы","хребет","перевал","вершина"]},{"id":"place.abroad_city","ru":"зарубежный город","aliases":["зарубежный город","иностранный город","заграница"]},{"id":"place.country","ru":"страна","aliases":["страна","страны","государство","зарубежный регион"]},{"id":"place.route","ru":"направление дороги","aliases":["направление","трасса","маршрут"]}]},{"id":"event","ru":"События и даты","aliases":["события","события и даты"],"children":[{"id":"event.date","ru":"памятная дата","aliases":["памятная дата","памятные даты","даты"]},{"id":"event.battle","ru":"битва","aliases":["битва","битвы","сражение","сражения","бой"]},{"id":"event.history","ru":"историческое событие","aliases":["историческое событие","исторические события","история"]}]},{"id":"nature","ru":"Природа","aliases":["природное"],"children":[{"id":"nature.plant","ru":"растение","aliases":["растение","растения","дерево","деревья","цветок","цветы","флора"]},{"id":"nature.animal","ru":"животное","aliases":["животное","животные","птица","птицы","фауна"]},{"id":"nature.landscape","ru":"ландшафт","aliases":["ландшафт","поле","роща","долина","луг"]},{"id":"nature.material","ru":"материал","aliases":["материал","материалы","минерал","минералы","металл","камень"]}]},{"id":"concept","ru":"Понятия и объекты","aliases":["понятия","понятия и объекты"],"children":[{"id":"concept.abstract","ru":"абстрактное понятие","aliases":["абстрактное","абстракция","идея","идеи","абстрактное понятие"]},{"id":"concept.object","ru":"объект, сооружение","aliases":["объект","объекты","сооружение","сооружения","здание","предмет"]},{"id":"concept.craft","ru":"ремесло","aliases":["ремесло","ремесла","промысел","хозяйство"]}]},{"id":"none","ru":"Без эпонима","aliases":["без эпонима"],"children":[{"id":"none.numbered","ru":"номерная улица","aliases":["номерная","номерные","номерная улица"]},{"id":"none.unknown","ru":"не установлено","aliases":["не установлено","неизвестно"]}]}],"kinds":{"person":["персона","персоны","человек","люди"],"persons_multi":["несколько человек","персона","персоны","человек","люди"],"group":["группа"],"fictional_character":["вымышленный"],"toponym":["топоним","место"],"event_date":["событие","дата"],"nature":["природа"],"concept":["понятие"],"object":["предмет-объект"],"no_eponym":["без названия в честь"],"unknown":["неясно"]},"e":[]}