{"v":1,"taxonomy":[{"id":"lit","ru":"Литература","aliases":["литература","литератор","литераторы"],"children":[{"id":"lit.poet","ru":"поэт","aliases":["поэт","поэтесса","поэты"]},{"id":"lit.writer","ru":"писатель","aliases":["писатель","писательница","писатели","прозаик"]},{"id":"lit.playwright","ru":"драматург","aliases":["драматург"]}]},{"id":"power","ru":"Власть","aliases":["власть","правитель"],"children":[{"id":"power.monarch","ru":"царь","aliases":["царь","царица","король","монарх"]},{"id":"power.revolutionary","ru":"революционер","aliases":["революционер"]},{"id":"power.public","ru":"общественный деятель","aliases":["общественный деятель","общественник"]}]},{"id":"mil","ru":"Военные","aliases":["военные","военный"],"children":[{"id":"mil.commander","ru":"полководец","aliases":["полководец","военачальник","генерал"]},{"id":"mil.hero","ru":"герой войны","aliases":["герой войны","герой"]}]},{"id":"rel","ru":"Религия","aliases":["религия"],"children":[{"id":"rel.saint","ru":"святой","aliases":["святой","святая"]}]},{"id":"sci","ru":"Наука","aliases":["наука","учёный","ученый"],"children":[{"id":"sci.engineer","ru":"инженер","aliases":["инженер"]}]},{"id":"art","ru":"Искусство","aliases":["искусство"],"children":[{"id":"art.composer","ru":"композитор","aliases":["композитор"]}]},{"id":"biz","ru":"Меценаты","aliases":["меценаты"],"children":[{"id":"biz.patron","ru":"меценат","aliases":["меценат"]},{"id":"biz.entrepreneur","ru":"предприниматель","aliases":["предприниматель","купец"]}]},{"id":"group","ru":"Группы","aliases":["группы"],"children":[{"id":"group.family","ru":"братья и семьи","aliases":["братья","семья"]}]},{"id":"place","ru":"Топонимы","aliases":["топонимы"],"children":[{"id":"place.tbilisi","ru":"место в Тбилиси","aliases":["место в тбилиси"]},{"id":"place.foreign_city","ru":"зарубежный город","aliases":["зарубежный город"]}]},{"id":"nature","ru":"Природа","aliases":["природа и ландшафт"],"children":[{"id":"nature.landscape","ru":"ландшафт","aliases":["ландшафт"]}]},{"id":"concept","ru":"Понятия","aliases":["понятия"],"children":[{"id":"concept.abstract","ru":"абстрактное","aliases":["абстрактное","абстракция"]}]}],"kinds":{"person":["персона","человек","люди"],"toponym":["топоним","место"],"event_date":["событие","дата"],"nature":["природа"],"concept":["понятие"],"group":["группа"]},"e":[{"ka":"ლადო ასათიანი","ru":"Ладо Асатиани","en":"Lado Asatiani","k":"person","cat":["lit.poet"],"occ":["поэт"],"g":"m","b":1917,"d":1943,"o":"ge","desc":"грузинский поэт","src":"osm","conf":0.97,"ai":0},{"ka":"შოთა რუსთაველი","ru":"Шота Руставели","en":"Shota Rustaveli","k":"person","cat":["lit.poet"],"occ":["поэт","государственный деятель"],"g":"m","b":1160,"d":1220,"o":"ge","desc":"грузинский поэт XII века, автор поэмы «Витязь в тигровой шкуре»","src":"wd_match","conf":0.99,"ai":0},{"ka":"თავისუფლება","ru":"Свобода","en":"Freedom","k":"concept","cat":["concept.abstract"],"desc":"понятие «свобода»","src":"rules","conf":0.9,"ai":1},{"ka":"გალაკტიონ ტაბიძე","ru":"Галактион Табидзе","en":"Galaktion Tabidze","q":"Q144086","k":"person","cat":["lit.poet"],"occ":["поэт"],"g":"m","b":1891,"d":1959,"o":"ge","desc":"грузинский поэт","src":"osm","conf":0.98,"ai":0},{"ka":"კოტე აფხაზი","ru":"Коте Апхази","en":"Kote Apkhazi","k":"person","cat":["mil.commander","mil.hero"],"occ":["генерал","военачальник"],"g":"m","b":1867,"d":1923,"o":"ge","desc":"грузинский генерал, национальный герой","src":"wd_match","conf":0.93,"ai":0},{"ka":"ერეკლე II","ru":"Ираклий II","en":"Erekle II","k":"person","cat":["power.monarch","mil.commander"],"occ":["царь","монарх","полководец"],"g":"m","b":1720,"d":1798,"o":"ge","desc":"царь Картли-Кахетинского царства","src":"wd_match","conf":0.96,"ai":0},{"ka":"მეტეხი","ru":"Метехи","en":"Metekhi","k":"toponym","cat":["place.tbilisi"],"desc":"исторический район Тбилиси на скале над Курой","src":"rules","conf":0.9,"ai":1},{"ka":"ეკატერინე გაბაშვილი","ru":"Екатерина Габашвили","en":"Ekaterine Gabashvili","k":"person","cat":["lit.writer","power.public"],"occ":["писательница","общественная деятельница"],"g":"f","b":1851,"d":1938,"o":"ge","desc":"грузинская писательница и общественная деятельница","src":"wd_match","conf":0.92,"ai":0},{"ka":"ვახტანგ გორგასალი","ru":"Вахтанг Горгасали","en":"Vakhtang Gorgasali","k":"person","cat":["power.monarch","rel.saint","mil.hero"],"occ":["царь","святой"],"g":"m","b":440,"d":502,"o":"ge","desc":"царь Иберии, по преданию основатель Тбилиси","src":"wd_match","conf":0.97,"ai":0},{"ka":"სოლოლაკი","ru":"Сололаки","en":"Sololaki","k":"toponym","cat":["place.tbilisi"],"desc":"исторический район Тбилиси","src":"rules","conf":0.95,"ai":0},{"ka":"ზუბალაშვილები","ru":"братья Зубалашвили","en":"Zubalashvili brothers","k":"persons_multi","cat":["biz.patron","group.family"],"occ":["меценат","предприниматель"],"g":"m","b":1840,"d":1920,"o":"ge","desc":"тифлисские купцы-меценаты","src":"llm","conf":0.8,"ai":1},{"ka":"ალექსანდრე პუშკინი","ru":"Александр Пушкин","en":"Alexander Pushkin","q":"Q7200","k":"person","cat":["lit.poet","lit.playwright"],"occ":["поэт","писатель","драматург"],"g":"m","b":1799,"d":1837,"o":"fo","desc":"русский поэт, бывал в Тифлисе в 1829 году","src":"osm","conf":0.99,"ai":0},{"ka":"რიყე","ru":"Рике","en":"Rike","k":"nature","cat":["nature.landscape"],"desc":"галечный речной берег","src":"rules","conf":0.85,"ai":1},{"ka":"ბესიკი","ru":"Бесики","en":"Besiki","k":"person","cat":["lit.poet"],"occ":["поэт","дипломат"],"g":"m","b":1750,"d":1791,"o":"ge","desc":"грузинский поэт и дипломат (Бесарион Габашвили)","src":"wd_match","conf":0.9,"ai":0},{"ka":"კონსტანტინე ლესელიძე","ru":"Константин Леселидзе","en":"Konstantine Leselidze","k":"person","cat":["mil.commander"],"occ":["генерал-полковник","военачальник"],"g":"m","b":1903,"d":1944,"o":"ge","desc":"советский генерал-полковник","src":"enc2008","conf":0.9,"ai":0},{"ka":"ვლადიმერ ლენინი","ru":"Владимир Ленин","en":"Vladimir Lenin","k":"person","cat":["power.revolutionary"],"occ":["революционер","политик"],"g":"m","b":1870,"d":1924,"o":"fo","desc":"русский революционер, глава Советского государства","src":"enc2008","conf":0.95,"ai":0}]}